,"tom mckeever",,,,,"@judytgolf",,,,,,,,,,,,,,,,,,,,,,,,,,,,,,,,,,,,,,,,,,"1",,,"china virus  -filter:nativeretweets","0","0","0","When Senator Rand Paul🇺🇸 fought  to prove FAUCI 😈the Cash Man behind the China Virus☠️ now tells the inside truth of👅 Never Hickie Nikki 😡 She will Suck🤤 the Blood & Money for her own destruction of America! This B!tch wants to start her accumulation of real estate and Cash!","2024-01-17 00:39:00+00:00",,,"https://pbs.twimg.com/profile_images/1355720394582331394/zboR8e78_400x400.jpg",,,,,,,,,,,,,,,,,,,,,,,"1747418361527705975",,,,,,,,,,,,,,,,,,,,,"https://twitter.com/tommckeever3/status/1747418361527705975","@tommckeever3"
,"Meg",,,,,"@RandPaul",,,,,,,,,,,,,,,,,,,,,,,,,,,,,,,,,,,,,,,,,,"0",,,"china virus  -filter:nativeretweets","0","0","0","Please lock this leprechaun up! I lost my dad to the china virus and I want justice!!","2024-01-17 00:38:00+00:00",,,"https://abs.twimg.com/sticky/default_profile_images/default_profile_400x400.png",,,,,,,,,,,,,,,,,,,,,,,"1747418114579378257",,,,,,,,,,,,,,,,,,,,,"https://twitter.com/Meg_lgb/status/1747418114579378257","@Meg_lgb"
,"michaelwalsh",,,,,"@StevenWalkerCFA","@joceyreyes209","@tolmanbrett",,,,,,,,,,,,,,,,,,,,,,,,,,,,,,,,,,,,,,,,"1",,,"china virus  -filter:nativeretweets","0","0","0","That's not true Trump had the best economic numbers in modern history , 4 4.5% gdp, a ripping stock market , low unemployment no crime ,wall being built, every person had more money under Trump. China virus was unleashed to stop him , they did then stole 2020 election 6 mil. Dead","2024-01-17 00:36:00+00:00",,,"https://pbs.twimg.com/profile_images/1646819180136497153/Ux2QqOEo_400x400.jpg",,,,,,,,,,,,,,,,,,,,,,,"1747417643881992580",,,,,,,,,,,,,,,,,,,,,"https://twitter.com/banrube/status/1747417643881992580","@banrube"
,"Kevin Sledz",,,,,"@SeamusORegan",,,,,,,,,,,,,,,,,,,,,,,,,,,,,,,,,,,,,,,,,,"0",,,"china virus  -filter:nativeretweets","0","0","0","But your liberal hamas communist regime can issue illegal orders to the CAF and kill members you can mandates illegal orders and arrest canadains during the China virus you can mutilate children  you can commit manslaughter over 40000 times for harm reduction.  lawyer up criminal","2024-01-17 00:35:00+00:00",,,"https://pbs.twimg.com/profile_images/1587517247001890816/nMEznfrQ_400x400.jpg",,,,,,,,,,,,,,,,,,,,,,,"1747417361047789909",,,,,,,,,,,,,,,,,,,,,"https://twitter.com/ksledz1966/status/1747417361047789909","@ksledz1966"
,"Manimal",,,,,"@JaredRyanSears","@JoeBiden",,,,,,,,,,,,,,,,,,,,,,,,,,,,,,,,,,,,,,,,,"10",,,"china virus  -filter:nativeretweets","0","0","1","TRUMPS lies??
Uh....the Steele Dossier, 
Crossfire Hurricane,  51 intelligence officials saying Hunters laptop was Russian disinformation, 
Russia Russia Russia and
The China virus didn't come from a lab. 
Sit down.","2024-01-17 00:34:00+00:00",,,"https://pbs.twimg.com/profile_images/1594704717006966786/chUdyAA5_400x400.jpg",,,,,,,,,,,,,,,,,,,,,,,"1747417085599248826",,,,,,,,,,,,,,,,,,,,,"https://twitter.com/danhelotes/status/1747417085599248826","@danhelotes"
,"Moderate Centrist",,,,,"@DailyMail",,,,,,,,,,,,,,,,,,,,,,,,,,,,,,,,,,,,,,,,,,"1",,,"china virus  -filter:nativeretweets","0","0","0","can I at least call this one the China virus?","2024-01-17 00:29:00+00:00",,,"https://pbs.twimg.com/profile_images/1628824394096148481/ZWxKTmKn_400x400.jpg",,,,,,,,,,,,,,,,,,,,,,,"1747415914306326652",,,,,,,,,,,,,,,,,,,,,"https://twitter.com/TerroirDuGolfe/status/1747415914306326652","@TerroirDuGolfe"
,"China Virus 🦠 FJB",,,,,"@RSBNetwork",,,,,,,,,,,,,,,,,,,,,,,,,,,,,,,,,,,,,,,,,,"1",,,"china virus  -filter:nativeretweets","0","0","0","I hope this means he isn’t picking her for VP.","2024-01-17 00:29:00+00:00",,,"https://pbs.twimg.com/profile_images/977908601003134976/vgecUAjL_400x400.jpg",,,,,,,,,,,,,,,,,,,,,,,"1747415865820086276",,,,,,,,,,,,,,,,,,,,,"https://twitter.com/jthvac04/status/1747415865820086276","@jthvac04"
,"China Virus🇮🇱",,,,,"@berniehoe2",,,,,,,,,,,,,,,,,,,,,,,,,,,,,,,,,,,,,,,,,,"0",,,"china virus  -filter:nativeretweets","0","0","0","Leave then","2024-01-17 00:21:00+00:00",,,"https://pbs.twimg.com/profile_images/1490169008716406786/6kfjpRhK_400x400.jpg",,,,,,,,,,,,,,,,,,,,,,,"1747413808556003587",,,,,,,,,,,,,,,,,,,,,"https://twitter.com/PalestineScrew/status/1747413808556003587","@PalestineScrew"
,"Maria Hamby",,,,,,,,,,,,,,,,,,,,,,,,,,,,,,,,,,,,,,,,,,,,,,,"0",,,"china virus  -filter:nativeretweets","0","0","0","instagram.com/p/C2LRtWOuPU0/…
All Democrats and their voters should be FORCED to have to move to China for their Chinavirus they brought to America.","2024-01-17 00:12:00+00:00",,,"https://pbs.twimg.com/profile_images/1712193540158099456/0Z1cqYXf_400x400.jpg",,,,,,,,,,,,,,,,,,,,,,,"1747411615371104321","https://www.instagram.com/p/C2LRtWOuPU0/?igsh=Y2NwNzVnMjE5MGtx",,,,,,,,,,,,,,,,,,,,"https://twitter.com/maria_hamby45/status/1747411615371104321","@maria_hamby45"
,"Leslie Shane",,,,,"@CDCDirector",,,,,,,,,,,,,,,,,,,,,,,,,,,,,,,,,,,,,,,,,,"1",,,"covid virus  -filter:nativeretweets","0","0","0","You are a ring a ding ding donger of a doc! Which virus should we vaccinate for? Nothing worked against seasonal flu, colds or covid none of it! So take whatever number booster your on and stuff it!","2024-01-18 01:56:00+00:00",,,"https://pbs.twimg.com/profile_images/2482334337/P7110160_400x400.JPG",,,,,,,,,,,,,,,,,,,,,,,"1747800133138370698",,,,,,,,,,,,,,,,,,,,,"https://twitter.com/leslie_shane/status/1747800133138370698","@leslie_shane"
,"Cesar 🇵🇦",,,,,,,,,,,,,,,,,,,,,,,,,,,,,,,,,,,,,,,,,,,,,,,"1",,,"covid virus  -filter:nativeretweets","0","1","0","Esto es muy bueno. Le preguntan al director deñ la OMS, ñcamino d la reunión  Foro  Davos, ""¿cuándo piensan liberar el próximo virus X?"",además d inquirirle por el cambio d la definición d pandemia y d inmunidad d grupo, previa a la liberación  Covid 19.","2024-01-18 01:56:00+00:00",,,"https://pbs.twimg.com/profile_images/1519043521885483008/wPh8--xP_400x400.jpg",,,,,,,,,,,,,,,,,,,,,,,"1747800018277298423",,,,,,,,,,,,,,,,,,,,,"https://twitter.com/CesarWi98065754/status/1747800018277298423","@CesarWi98065754"
,"Virus Internet","https://pbs.twimg.com/media/GEFugYAaEAA5g50.jpg?format=jpg&name=medium",,,,,,,,,,,,,,,,,,,,,,,,,,,,,,,,,,,,,,,,,,,,,,"62",,,"covid virus  -filter:nativeretweets","0","68","5","Kenali gejala Covid-19 JN.1
#Virus
#ProkesCovid
#EndemiCovid 

HAECHAN LEE THANK YOU NCT WISH
Circle to Search with Google Kamis","2024-01-18 01:55:00+00:00",,,"https://pbs.twimg.com/profile_images/1095948326548074496/UdOptG_h_400x400.jpg","#Virus","#ProkesCovid","#EndemiCovid",,,,,,,,,,,,,,,,,,,,"1747799875507700177",,,,,,,,,,,,,,,,,,,,,"https://twitter.com/virusketik/status/1747799875507700177","@virusketik"
,"Tracy Lee Timbery",,,,,,,,,,,,,,,,,,,,,,,,,,,,,,,,,,,,,,,,,,,,,,,"0",,,"covid virus  -filter:nativeretweets","0","0","0","The globalist’s have another Plandemic planned. Davos convention statin a virus named X will come to be, & it will be 20 times more lethal than covid. How is this not an act of terrorism? Coinciding with the WHO amended treaty giving WHO power to lock us down & jab us forcefully","2024-01-18 01:54:00+00:00",,,"https://pbs.twimg.com/profile_images/1610727742479437824/9cNXt8Sr_400x400.jpg",,,,,,,,,,,,,,,,,,,,,,,"1747799483864551562",,,,,,,,,,,,,,,,,,,,,"https://twitter.com/racytracy66/status/1747799483864551562","@racytracy66"
,"Attila imar",,,,,"@KatKanada_TM",,,,,,,,,,,,,,,,,,,,,,,,,,,,,,,,,,,,,,,,,,"0",,,"covid virus  -filter:nativeretweets","0","0","0","I hope that she is carrying the covid virus 🤣","2024-01-18 01:53:00+00:00",,,"https://pbs.twimg.com/profile_images/1738601831495069696/XJibj-oD_400x400.jpg",,,,,,,,,,,,,,,,,,,,,,,"1747799262459818339",,,,,,,,,,,,,,,,,,,,,"https://twitter.com/tatransfer/status/1747799262459818339","@tatransfer"
,"Chval Chvil",,,,,"@SadRobot1980",,,,,,,,,,,,,,,,,,,,,,,,,,,,,,,,,,,,,,,,,,"2",,,"covid virus  -filter:nativeretweets","0","0","1","""The virus in question is not a COVID-19 strain... 

Do you find this helpful?""

Now, do I? Not being brain-dead (yet), nope. Very missing the problem. Sometimes unfounded fear is the only rational reaction left.","2024-01-18 01:51:00+00:00",,,"https://pbs.twimg.com/profile_images/1669450380382535680/ekwY1LQl_400x400.jpg",,,,,,,,,,,,,,,,,,,,,,,"1747798844702626254",,,,,,,,,,,,,,,,,,,,,"https://twitter.com/mononokle/status/1747798844702626254","@mononokle"
,"Noel Hastings",,,,,"@P_J_Buckhaults",,,,,,,,,,,,,,,,,,,,,,,,,,,,,,,,,,,,,,,,,,"2",,,"covid virus  -filter:nativeretweets","0","0","0","I would argue the “seriousness” of this virus has been weaponized and is untrue. As an ER doctor who never stayed home and cared for all of this since the beginning I assure you influenza and RSV making people sicker right now. COVID still serious for some populations but no more so than other viruses that no one seems to care about anymore.","2024-01-18 01:50:00+00:00",,,"https://pbs.twimg.com/profile_images/1728452773099036672/h0ekGO_a_400x400.jpg",,,,,,,,,,,,,,,,,,,,,,,"1747798507195679072",,,,,,,,,,,,,,,,,,,,,"https://twitter.com/HastingsNoel/status/1747798507195679072","@HastingsNoel"
,"gruber",,,,,"@0iSakura",,,,,,,,,,,,,,,,,,,,,,,,,,,,,,,,,,,,,,,,,,"0",,,"covid virus  -filter:nativeretweets","0","0","0","é assim que a ciencia funciona kkkk 

tem muito vírus muito pior que o COVID em laboratórios de categoria BSL-4, incluíndo mutações mais letais do próprio COVID que estão sendo estudadas para compreender como criar vacinas etc","2024-01-18 01:49:00+00:00",,,"https://pbs.twimg.com/profile_images/1747673991936917504/fNJbJNOh_400x400.jpg",,,,,,,,,,,,,,,,,,,,,,,"1747798429441359995",,,,,,,,,,,,,,,,,,,,,"https://twitter.com/CymaticSaboteur/status/1747798429441359995","@CymaticSaboteur"
,"Nux","https://pbs.twimg.com/media/GEFtP2FWMAAZ5z4.jpg?format=jpg&name=medium","https://pbs.twimg.com/media/GEFtQYSWYAAbQwP.jpg?format=jpg&name=medium","https://pbs.twimg.com/media/GEFtQ39XoAA9Pl6.jpg?format=jpg&name=medium",,"@dpl003",,,,,,,,,,,,,,,,,,,,,,,,,,,,,,,,,,,,,,,,,,"1",,,"covid virus  -filter:nativeretweets","0","2","0","Its a reconstruction of a very real virus. That is imaged with microscopes and rendered into a CGI model. Hence model, its modeled after the real thing, that image wouldnt exist if covid didnt, software could of never made it. Again the ""do your own research"" crowd, cant research","2024-01-18 01:49:00+00:00",,,"https://pbs.twimg.com/profile_images/1344896190173868032/0dwkZ0tL_400x400.jpg",,,,,,,,,,,,,,,,,,,,,,,"1747798278475842045",,,,,,,,,,,,,,,,,,,,,"https://twitter.com/ItsNux/status/1747798278475842045","@ItsNux"
,"Thunder Warrior 37",,,,,"@Timcast","@tossoff87",,,,,,,,,,,,,,,,,,,,,,,,,,,,,,,,,,,,,,,,,"0",,,"covid virus  -filter:nativeretweets","0","0","0","So that guy might’ve been infected with the Chinese covid virus?","2024-01-18 01:49:00+00:00",,,"https://pbs.twimg.com/profile_images/1737547124177350656/8VeUwcNX_400x400.jpg",,,,,,,,,,,,,,,,,,,,,,,"1747798243436646767",,,,,,,,,,,,,,,,,,,,,"https://twitter.com/37Warrior72970/status/1747798243436646767","@37Warrior72970"
,"Natural Bodys","https://pbs.twimg.com/media/GEFtPR7bwAA0xH9.jpg?format=jpg&name=medium",,,,,,,,,,,,,,,,,,,,,,,,,,,,,,,,,,,,,,,,,,,,,,"0",,,"covid virus  -filter:nativeretweets","0","0","0","Científicos de China manipulan virus relacionado al Covid con tasa de mortalidad del 100% dlvr.it/T1X2bN","2024-01-18 01:49:00+00:00",,,"https://pbs.twimg.com/profile_images/1071931418400436226/qt2x_onU_400x400.jpg",,,,,,,,,,,,,,,,,,,,,,,"1747798241402577217","http://dlvr.it/T1X2bN",,,,,,,,,,,,,,,,,,,,"https://twitter.com/bodys_natural/status/1747798241402577217","@bodys_natural"
,"Stephen",,,,,"@davidicke",,,,,,,,,,,,,,,,,,,,,,,,,,,,,,,,,,,,,,,,,,"0",,,"covid virus  -filter:nativeretweets","0","0","0","@DrJohnCampbell3 have a Covid and vaxx-related/#BigPharm discussion with @davidicke!  It'll #breaktheinternet!!
Also, have a chat with @drtomcowan & @AndrewKaufmanMD about Bechamp, Terrain, Virus Question while you're at it.","2024-01-18 01:49:00+00:00",,,"https://pbs.twimg.com/profile_images/874832098208632832/7yGCwmzx_400x400.jpg","#BigPharm","#breaktheinternet",,,,,,,,,,,,,,,,,,,,,"1747798237963264326",,,,"DrJohnCampbell3","davidicke","drtomcowan","AndrewKaufmanMD",,,,,,,,,,,,,,"https://twitter.com/Shakey719/status/1747798237963264326","@Shakey719"
,"Anite",,,,,"@destapandolose1","@MagoNectanebo",,,,,,,,,,,,,,,,,,,,,,,,,,,,,,,,,,,,,,,,,"2",,,"covid virus  -filter:nativeretweets","0","0","0","El virus q viene es más potente q el del COVID; la meta es matar más.","2024-01-18 01:48:00+00:00",,,"https://pbs.twimg.com/profile_images/1636786392188481537/n5TvYOmc_400x400.jpg",,,,,,,,,,,,,,,,,,,,,,,"1747798153456177596",,,,,,,,,,,,,,,,,,,,,"https://twitter.com/Anite528/status/1747798153456177596","@Anite528"
,"𝐉𝐃𝐎𝐆 𝒰𝓃𝓁𝑒𝒶𝓈𝒽𝑒𝒹┊ᴠʜ1 ʟᴇɢᴀᴄʏ",,,,,"@stkirsch","@sjkroger",,,,,,,,,,,,,,,,,,,,,,,,,,,,,,,,,,,,,,,,,"4",,,"covid virus  -filter:nativeretweets","0","0","0","I'm not finding anything about horse deaths in Australia from Covid vaccines. There are news reports and a law suit (dismissed) regarding Horse deaths and adverse events from the Hendra virus vaccine.

From reading a little: Hendra virus has 57% human fatality rate, but there are only 7 cases listed on the NSW Government Health website since 1994.

80% CFR in horses has been reported. On a quick glance there is a significant difference in the risk/benefit if you are referencing Hendra virus vaccinations for horses.

Federal court case:
abc.net.au/news/2022-11-23/h…

News outline about Henra in Queensland:
abc.net.au/news/2022-07-11/v…

NSW Health Info:
health.nsw.gov.au/Infectious…","2024-01-18 01:46:00+00:00",,,"https://pbs.twimg.com/profile_images/1724992287938318336/DwLE-t-x_400x400.jpg",,,,,,,,,,,,,,,,,,,,,,,"1747797516568113529","https://www.abc.net.au/news/2022-11-23/hendra-vaccine-side-effects-federal-court-class-action/101687258","https://www.abc.net.au/news/2022-07-11/vaccine-push-after-hendra-virus-found-in-north-queensland/101226220","https://www.health.nsw.gov.au/Infectious/controlguideline/Pages/hendra-case-summary.aspx",,,,,,,,,,,,,,,,,,"https://twitter.com/ASKJDOG/status/1747797516568113529","@ASKJDOG"
,"keepitreal",,,,,"@ecoscientist22","@ProfKlausSchwab",,,,,,,,,,,,,,,,,,,,,,,,,,,,,,,,,,,,,,,,,"0",,,"covid virus  -filter:nativeretweets","0","0","0","Effing cowards !!!! Of course they don’t want replies to the effing lies they’re trying to shove down people’s throats !!! They don’t want to hear people’s voices about the genocide they’re planning !  Will it be an even deadlier Covid virus ? Why they decide who dies ? 🤬🐖💩🐀","2024-01-18 01:46:00+00:00",,,"https://pbs.twimg.com/profile_images/1738351306228539393/FN7-0GE9_400x400.jpg",,,,,,,,,,,,,,,,,,,,,,,"1747797507059384404",,,,,,,,,,,,,,,,,,,,,"https://twitter.com/latenightlupus/status/1747797507059384404","@latenightlupus"
,"Stace Magee",,,,,"@elonmusk",,,,,,,,,,,,,,,,,,,,,,,,,,,,,,,,,,,,,,,,,,"1",,,"covid virus  -filter:nativeretweets","0","0","0","Reminds me of the Oprah Car giveaway...
You get a COVID virus!... Next seat gets a free COVID virus! EVERYONE ON STAGE GETS THE COVID!!!!🤣🤣🤣","2024-01-18 01:46:00+00:00",,,"https://pbs.twimg.com/profile_images/1701884485992595456/lCy0tHPT_400x400.jpg",,,,,,,,,,,,,,,,,,,,,,,"1747797458283889152",,,,,,,,,,,,,,,,,,,,,"https://twitter.com/AGENT_IRISH_INC/status/1747797458283889152","@AGENT_IRISH_INC"
,"joanofarc1M",,,,,,,,,,,,,,,,,,,,,,,,,,,,,,,,,,,,,,,,,,,,,,,"2",,,"covid virus  -filter:nativeretweets","1","0","1","Can't someone sue him for lying about a deadly virus? 

I just got over covid and had I not had every single vax that came out, I'd probably be dead as am old

RSV is also very deadly and of course, I had that vax","2024-01-18 01:44:00+00:00",,,"https://pbs.twimg.com/profile_images/1662488837006958595/lmMDdkNY_400x400.jpg",,,,,,,,,,,,,,,,,,,,,,,"1747797125956800836",,,,,,,,,,,,,,,,,,,,,"https://twitter.com/joanofarcthe1st/status/1747797125956800836","@joanofarcthe1st"
,"Eugene","https://pbs.twimg.com/media/GEF83FWWAAAyZ_G.jpg?format=jpg&name=medium","https://pbs.twimg.com/media/GEF83FXWMAA7wql.jpg?format=jpg&name=medium","https://pbs.twimg.com/media/GEF83FWWsAA4SsV.jpg?format=jpg&name=medium","https://pbs.twimg.com/media/GEF83FaWcAA5_Ox.jpg?format=jpg&name=medium","@trutharmyfilms",,,,,,,,,,,,,,,,,,,,,,,,,,,,,,,,,,,,,,,,,,"0",,,"covid19  -filter:nativeretweets","0","0","1","RT #NFL @MSNBC #Davos2024 all take #COVID19 profit USA 🇺🇸 @barstoolsports @KimDotcom @WallStreetSilv @laralogan #DallasCowboys","2024-01-18 02:57:00+00:00",,,"https://pbs.twimg.com/profile_images/1591102737772576769/w2cG2_N9_400x400.jpg","#NFL","#Davos2024","#COVID19","#DallasCowboys",,,,,,,,,,,,,,,,,,,"1747815428045341147",,,,"MSNBC","barstoolsports","KimDotcom","WallStreetSilv","laralogan",,,,,,,,,,,,,"https://twitter.com/Eugene646/status/1747815428045341147","@Eugene646"
,"Animal Político",,,,,,,,,,,,,,,,,,,,,,,,,,,,,,,,,,,,,,,,,,,,,,,"27",,,"covid19  -filter:nativeretweets","1","0","15","😷Ante el aumento de casos de #Covid19, te decimos dónde hacerte la prueba en unidades médicas y laboratorios de Ciudad de México. De acuerdo con la @SSalud_mx, podrás acudir de lunes a domingo a partir de las 9:00 horas.
animalpolitico.com/salud/cov…","2024-01-18 02:57:00+00:00",,,"https://pbs.twimg.com/profile_images/1741930996306513920/ums6NXQz_400x400.jpg","#Covid19",,,,,,,,,,,,,,,,,,,,,,"1747815323326165391","https://www.animalpolitico.com/salud/covid-19-prueba-en-cdmx",,,"SSalud_mx",,,,,,,,,,,,,,,,,"https://twitter.com/Pajaropolitico/status/1747815323326165391","@Pajaropolitico"
,"News Medical","https://pbs.twimg.com/media/GEF8uRqXkAAgL_I.jpg?format=jpg&name=medium",,,,,,,,,,,,,,,,,,,,,,,,,,,,,,,,,,,,,,,,,,,,,,"2",,,"covid19  -filter:nativeretweets","0","0","1","Who's at greater risk for long-COVID? New study sheds light on vulnerable demographics 🦠📊🔍 news-medical.net/news/202401… #LongCOVID #COVID19 #HealthResearch #PandemicAftermath #ChronicIllness #PublicHealth #RiskFactors #CommunityHealth @medrxivpreprint","2024-01-18 02:56:00+00:00",,,"https://pbs.twimg.com/profile_images/780395551565058048/104TSnWw_400x400.jpg","#LongCOVID","#COVID19","#HealthResearch","#PandemicAftermath","#ChronicIllness","#PublicHealth","#RiskFactors","#CommunityHealth",,,,,,,,,,,,,,,"1747815269123104852","https://www.news-medical.net/news/20240117/Whos-at-greater-risk-for-long-COVID-New-study-sheds-light-on-vulnerable-demographics.aspx",,,"medrxivpreprint",,,,,,,,,,,,,,,,,"https://twitter.com/NewsMedical/status/1747815269123104852","@NewsMedical"
,"Baron","https://pbs.twimg.com/media/GEF8l8VWkAAx2DB.jpg?format=jpg&name=medium",,,,,,,,,,,,,,,,,,,,,,,,,,,,,,,,,,,,,,,,,,,,,,"0",,,"covid19  -filter:nativeretweets","0","0","0","Ninjas Have No Trouble Wearing Face Masks

dailysquib.co.uk/world/37864…
#masks #covid19","2024-01-18 02:56:00+00:00",,,"https://pbs.twimg.com/profile_images/1555175161292374017/s0EHr3Vz_400x400.jpg","#masks","#covid19",,,,,,,,,,,,,,,,,,,,,"1747815123723354531","https://www.dailysquib.co.uk/world/37864-ninjas-have-no-trouble-about-wearing-face-masks.html",,,,,,,,,,,,,,,,,,,,"https://twitter.com/VirgilsPancake/status/1747815123723354531","@VirgilsPancake"
,"APPLEMACONE APPLEJOBS VINFASTAR APPLECAR ZAPPACAR",,,,,,,,,,,,,,,,,,,,,,,,,,,,,,,,,,,,,,,,,,,,,,,"0",,,"covid19  -filter:nativeretweets","0","0","0","HELLO
HÉ LỘ ĐÈN
THEO DÕI ĐƯỢC TÂM PHỤC HỒI CỦA BIẾN ĐỔI KHÍ QUYỂN VÀ ỔN ĐỊNH COVID19 TA SẼ THA THỨ CHO CÁC KHÁCH SẠN NHÀ HÀNG SHOWROOM TRƯNG BÀY XE Ô TÔ #VINFAST ĐƯỢC DỰ ÁN TRẢI NGHIỆM TRI THỨC TRÍ TUỆ NHÂN TẠO KIỂU TESLA.COM THEO @EL","2024-01-18 02:56:00+00:00",,,"https://pbs.twimg.com/profile_images/1747433491850297344/qU5bujUL_400x400.jpg","#VINFAST",,,,,,,,,,,,,,,,,,,,,,"1747815072561614873","http://TESLA.COM",,,"EL",,,,,,,,,,,,,,,,,"https://twitter.com/OPHONEMACINTOSH/status/1747815072561614873","@OPHONEMACINTOSH"
,"Entre Todos Digital","https://pbs.twimg.com/media/GEF8Y6baoAAUgJF.jpg?format=jpg&name=medium",,,,,,,,,,,,,,,,,,,,,,,,,,,,,,,,,,,,,,,,,,,,,,"0",,,"covid19  -filter:nativeretweets","0","0","0","#EntreTodos🎙️ 
📰 Científicos chinos alertan sobre cepa mortal de Covid19

📰 Captan a familia de Coatíes en Hermosillo.

📰 Cuidado con el fraude de préstamos 'Gota a Gota' 

#EnDirecto 
🔴 YouTube: bit.ly/3O8zPVw 
🔴  FB: bit.ly/3ci9kP4","2024-01-18 02:55:00+00:00",,,"https://pbs.twimg.com/profile_images/1622655777344458752/boP3I3lJ_400x400.jpg","#EntreTodos","#EnDirecto",,,,,,,,,,,,,,,,,,,,,"1747814902235005222","https://bit.ly/3O8zPVw","https://bit.ly/3ci9kP4",,,,,,,,,,,,,,,,,,,"https://twitter.com/InformativoET/status/1747814902235005222","@InformativoET"
,"Bjean",,,,,,,,,,,,,,,,,,,,,,,,,,,,,,,,,,,,,,,,,,,,,,,"0",,,"covid19  -filter:nativeretweets","0","0","0","So WEF went from planning and executing the covid19 global pandemic with 20 pages of population control gov enforced mandates — to blowing black magic spells in peoples faces…","2024-01-18 02:53:00+00:00",,,"https://pbs.twimg.com/profile_images/1258405603124404224/qgaQyAd2_400x400.jpg",,,,,,,,,,,,,,,,,,,,,,,"1747814334003134820",,,,,,,,,,,,,,,,,,,,,"https://twitter.com/SmilePointe/status/1747814334003134820","@SmilePointe"
,"Comedy College",,,,,,,,,,,,,,,,,,,,,,,,,,,,,,,,,,,,,,,,,,,,,,,"0",,,"covid19  -filter:nativeretweets","0","0","0","Film For Veterans: Laugh Addict -Toxic Drug or Best Medicine? buff.ly/3tW4yPU via @Veterans News Report #colorado #austin #lol #lmao #vcu #wv #westvirginia #hull #nufc #mufc #covid19 #coronavirus #md #nc","2024-01-18 02:53:00+00:00",,,"https://pbs.twimg.com/profile_images/886434030161346560/C-pLaHqG_400x400.jpg","#colorado","#austin","#lol","#lmao","#vcu","#wv","#westvirginia","#hull","#nufc","#mufc","#covid19","#coronavirus","#md","#nc",,,,,,,,,"1747814316080783791","https://buff.ly/3tW4yPU",,,"Veterans",,,,,,,,,,,,,,,,,"https://twitter.com/LaughOutNOW/status/1747814316080783791","@LaughOutNOW"
,"Justin",,,,,,,,,,,,,,,,,,,,,,,,,,,,,,,,,,,,,,,,,,,,,,,"0",,,"covid19  -filter:nativeretweets","0","0","0","If #WEF could pull of #COVID19 and cripple this planet with rules. What will they be capable of doing next","2024-01-18 02:52:00+00:00",,,"https://pbs.twimg.com/profile_images/1733501626131054592/0CioZ-2s_400x400.png","#WEF","#COVID19",,,,,,,,,,,,,,,,,,,,,"1747814203191366037",,,,,,,,,,,,,,,,,,,,,"https://twitter.com/DisabledJourney/status/1747814203191366037","@DisabledJourney"
,"Dennis Ortiz",,,,,,,,,,,,,,,,,,,,,,,,,,,,,,,,,,,,,,,,,,,,,,,"0",,,"covid19  -filter:nativeretweets","0","0","0","⚠️BREAKING - Chinese lab-made coronavirus GX_P2V, with 100% kill streak in ‘humanized’ mice: according to the latest research by People’s Liberation Army Bioweapon General Yi-Gang Tong. 

📍They have been creating and perfecting it in a lab Just like Covid19","2024-01-18 02:50:00+00:00",,,"https://pbs.twimg.com/profile_images/1663794668688261120/P01cmOIZ_400x400.jpg",,,,,,,,,,,,,,,,,,,,,,,"1747813652189892744",,,,,,,,,,,,,,,,,,,,,"https://twitter.com/DennisOrtiz3/status/1747813652189892744","@DennisOrtiz3"
,"𝓛𝓾𝓷𝓪𝓹𝓵𝓪𝓼𝓶𝓪 𝓽𝓾𝓫𝓮𝓻𝓬𝓾𝓵𝓸𝓼𝓲𝓼 ⌬",,,,,"@pamebanq","@El_Universal_Mx",,,,,,,,,,,,,,,,,,,,,,,,,,,,,,,,,,,,,,,,,"0",,,"covid19  -filter:nativeretweets","0","0","0","El virus de la noticia, el que es estudiado es distinto al de la COVID19. El de la noticia es de una muestra de pangolin, el que produce COVID19 tiene más parecido a los que se encuentran en murciélagos.","2024-01-18 02:49:00+00:00",,,"https://pbs.twimg.com/profile_images/1711172706266144768/lGjoZm3q_400x400.jpg",,,,,,,,,,,,,,,,,,,,,,,"1747813551488590047",,,,,,,,,,,,,,,,,,,,,"https://twitter.com/Lunaplasticidad/status/1747813551488590047","@Lunaplasticidad"
,"(No 25 - 1959) ANT","https://pbs.twimg.com/media/GEF7IeIaEAAdYAv.jpg?format=jpg&name=medium",,,,,,,,,,,,,,,,,,,,,,,,,,,,,,,,,,,,,,,,,,,,,,"0",,,"covid19  -filter:nativeretweets","0","0","0","@covidinquiryuk
#COVID19
@StevenJMiles
Qld might not have had 6 deaths
 if it wasn't for pathic greedy old conservative NSW MP.

Data supports isolation by limiting travel between states / cities.
Compiled this data in 2021.","2024-01-18 02:49:00+00:00",,,"https://pbs.twimg.com/profile_images/1446277705708703773/m6E-QC9Y_400x400.jpg","#COVID19",,,,,,,,,,,,,,,,,,,,,,"1747813518320259553",,,,"covidinquiryuk","StevenJMiles",,,,,,,,,,,,,,,,"https://twitter.com/01deadant/status/1747813518320259553","@01deadant"
,"とも吉",,,,,"@kkkfff1234k",,,,,,,,,,,,,,,,,,,,,,,,,,,,,,,,,,,,,,,,,,"1",,,"covid19  -filter:nativeretweets","0","0","0","covid19は2018年には決まっていたとか","2024-01-18 02:49:00+00:00",,,"https://abs.twimg.com/sticky/default_profile_images/default_profile_400x400.png",,,,,,,,,,,,,,,,,,,,,,,"1747813468030599387",,,,,,,,,,,,,,,,,,,,,"https://twitter.com/tomokichi721005/status/1747813468030599387","@tomokichi721005"
,"Stephanie Smith",,,,,,,,,,,,,,,,,,,,,,,,,,,,,,,,,,,,,,,,,,,,,,,"0",,,"covid19  -filter:nativeretweets","0","0","0","ICAN's interactive dashboard for #COVID19 vaccine adverse health impacts from @CDCgov official data.  This should horrify anyone with an ounce of bodily integrity. #Pfizer #Moderna #Fauci #WHO #BillGates I #GoodGermans icandecide.org/v-safe-data/","2024-01-18 02:48:00+00:00",,,"https://pbs.twimg.com/profile_images/857694550629810176/sRPOJZw__400x400.jpg","#COVID19","#Pfizer","#Moderna","#Fauci","#WHO","#BillGates","#GoodGermans",,,,,,,,,,,,,,,,"1747813243484020860","https://icandecide.org/v-safe-data/",,,"CDCgov",,,,,,,,,,,,,,,,,"https://twitter.com/milagrosfilms/status/1747813243484020860","@milagrosfilms"
